{
  "schemaVersion": "1.0.0",
  "generated": "2026-07-21",
  "campaign": "campaign_01",
  "title": "Willkommen zurück in Sunny Cove",
  "note": "Aufträge streng sequenziell (sequence). restorationActions: 'set_state:<id>' schaltet Bauzustand, 'unlock_element:<id>' ein platzierbares Element frei.",
  "orders": [
    {
      "id": "order_01",
      "sequence": 1,
      "character": "gull",
      "portrait": "characters/char_gull_happy.svg",
      "portraitPose": "happy",
      "dialog": "Willkommen zurück in Sunny Cove, Marina! Der Sturm war fies. Sammel mir ein paar Muscheln, dann fangen wir an.",
      "requiredItems": [
        {
          "item": "chain1_beach_2_small_shell",
          "asset": "items/chain1_beach_2_small_shell.svg",
          "displayName": "Kleine Muschel",
          "count": 2
        }
      ],
      "rewards": {
        "coins": 40
      },
      "xp": 10,
      "restorationActions": []
    },
    {
      "id": "order_02",
      "sequence": 2,
      "character": "marina",
      "portrait": "characters/char_marina_friendly.svg",
      "portraitPose": "friendly",
      "dialog": "Erst mal aufräumen. Bring mir noch ein paar Muscheln vom Strand.",
      "requiredItems": [
        {
          "item": "chain1_beach_2_small_shell",
          "asset": "items/chain1_beach_2_small_shell.svg",
          "displayName": "Kleine Muschel",
          "count": 3
        }
      ],
      "rewards": {
        "coins": 55
      },
      "xp": 12,
      "restorationActions": []
    },
    {
      "id": "order_03",
      "sequence": 3,
      "character": "kai",
      "portrait": "characters/char_kai_friendly.svg",
      "portraitPose": "friendly",
      "dialog": "Hey! Ich bin Kai. Für die Bar brauchen wir Limetten – tipp die Getränkekiste an.",
      "requiredItems": [
        {
          "item": "chain2_bar_2_limes",
          "asset": "items/chain2_bar_2_limes.svg",
          "displayName": "Limetten",
          "count": 2
        }
      ],
      "rewards": {
        "coins": 70,
        "energy": 5
      },
      "xp": 14,
      "restorationActions": []
    },
    {
      "id": "order_04",
      "sequence": 4,
      "character": "gull",
      "portrait": "characters/char_gull_neutral.svg",
      "portraitPose": "neutral",
      "dialog": "Ohne Werkzeug wird das nichts. Zeig mir, dass du eine Schraube auftreiben kannst.",
      "requiredItems": [
        {
          "item": "chain4_tool_1_screw",
          "asset": "items/chain4_tool_1_screw.svg",
          "displayName": "Schraube",
          "count": 3
        }
      ],
      "rewards": {
        "coins": 80
      },
      "xp": 16,
      "restorationActions": []
    },
    {
      "id": "order_05",
      "sequence": 5,
      "character": "marina",
      "portrait": "characters/char_marina_thoughtful.svg",
      "portraitPose": "thoughtful",
      "dialog": "Ein frischer Saft hilft beim Denken. Mixt du mir einen?",
      "requiredItems": [
        {
          "item": "chain2_bar_3_juice_glass",
          "asset": "items/chain2_bar_3_juice_glass.svg",
          "displayName": "Saftglas",
          "count": 1
        }
      ],
      "rewards": {
        "coins": 90,
        "gems": 1
      },
      "xp": 18,
      "restorationActions": []
    },
    {
      "id": "order_06",
      "sequence": 6,
      "character": "kai",
      "portrait": "characters/char_kai_excited.svg",
      "portraitPose": "excited",
      "dialog": "Die alte Theke lässt sich retten! Bring einen Schraubendreher, dann bau ich sie ein.",
      "requiredItems": [
        {
          "item": "chain4_tool_3_screwdriver",
          "asset": "items/chain4_tool_3_screwdriver.svg",
          "displayName": "Schraubendreher",
          "count": 1
        }
      ],
      "rewards": {
        "coins": 120,
        "energy": 10
      },
      "xp": 22,
      "restorationActions": [
        "unlock_element:elem_counter"
      ]
    },
    {
      "id": "order_07",
      "sequence": 7,
      "character": "shelly",
      "portrait": "characters/char_shelly_neutral.svg",
      "portraitPose": "neutral",
      "dialog": "Hallo, ich bin Shelly. Für meinen Garten – hast du ein Samenkorn?",
      "requiredItems": [
        {
          "item": "chain5_garden_1_seed",
          "asset": "items/chain5_garden_1_seed.svg",
          "displayName": "Samenkorn",
          "count": 3
        }
      ],
      "rewards": {
        "coins": 110
      },
      "xp": 20,
      "restorationActions": []
    },
    {
      "id": "order_08",
      "sequence": 8,
      "character": "marina",
      "portrait": "characters/char_marina_friendly.svg",
      "portraitPose": "friendly",
      "dialog": "Die Gäste kommen bald. Ein paar bunte Muscheln als Deko wären schön.",
      "requiredItems": [
        {
          "item": "chain1_beach_3_shell_trio",
          "asset": "items/chain1_beach_3_shell_trio.svg",
          "displayName": "Bunte Muscheln",
          "count": 2
        }
      ],
      "rewards": {
        "coins": 140
      },
      "xp": 24,
      "restorationActions": []
    },
    {
      "id": "order_09",
      "sequence": 9,
      "character": "kai",
      "portrait": "characters/char_kai_pointing.svg",
      "portraitPose": "pointing",
      "dialog": "Zeit fürs Dach! Mit einem Hammer kriegen wir das Gerüst hoch.",
      "requiredItems": [
        {
          "item": "chain4_tool_4_hammer",
          "asset": "items/chain4_tool_4_hammer.svg",
          "displayName": "Hammer",
          "count": 1
        },
        {
          "item": "chain1_beach_3_shell_trio",
          "asset": "items/chain1_beach_3_shell_trio.svg",
          "displayName": "Bunte Muscheln",
          "count": 1
        }
      ],
      "rewards": {
        "coins": 180,
        "gems": 2,
        "energy": 15
      },
      "xp": 40,
      "restorationActions": [
        "set_state:partial",
        "unlock_element:elem_roof"
      ]
    },
    {
      "id": "order_10",
      "sequence": 10,
      "character": "gull",
      "portrait": "characters/char_gull_happy.svg",
      "portraitPose": "happy",
      "dialog": "Sieht schon besser aus! Ein kühler Kokosdrink zur Feier?",
      "requiredItems": [
        {
          "item": "chain2_bar_5_coconut_drink",
          "asset": "items/chain2_bar_5_coconut_drink.svg",
          "displayName": "Kokosdrink",
          "count": 1
        }
      ],
      "rewards": {
        "coins": 160
      },
      "xp": 28,
      "restorationActions": []
    },
    {
      "id": "order_11",
      "sequence": 11,
      "character": "marina",
      "portrait": "characters/char_marina_thoughtful.svg",
      "portraitPose": "thoughtful",
      "dialog": "Sammel bitte eine kleine Muschelsammlung – die häng ich auf.",
      "requiredItems": [
        {
          "item": "chain1_beach_4_shell_collection",
          "asset": "items/chain1_beach_4_shell_collection.svg",
          "displayName": "Muschelsammlung",
          "count": 1
        }
      ],
      "rewards": {
        "coins": 190,
        "energy": 10
      },
      "xp": 32,
      "restorationActions": []
    },
    {
      "id": "order_12",
      "sequence": 12,
      "character": "kai",
      "portrait": "characters/char_kai_excited.svg",
      "portraitPose": "excited",
      "dialog": "Das Schild muss wieder ran, damit man uns findet!",
      "requiredItems": [
        {
          "item": "chain4_tool_5_tool_bag",
          "asset": "items/chain4_tool_5_tool_bag.svg",
          "displayName": "Werkzeugtasche",
          "count": 1
        },
        {
          "item": "chain2_bar_4_lemonade",
          "asset": "items/chain2_bar_4_lemonade.svg",
          "displayName": "Limonade",
          "count": 1
        }
      ],
      "rewards": {
        "coins": 220,
        "gems": 1
      },
      "xp": 38,
      "restorationActions": [
        "unlock_element:elem_sign"
      ]
    },
    {
      "id": "order_13",
      "sequence": 13,
      "character": "shelly",
      "portrait": "characters/char_shelly_happy.svg",
      "portraitPose": "happy",
      "dialog": "Meine erste Pflanze wächst! Bring mir eine kleine Pflanze zum Vergleich.",
      "requiredItems": [
        {
          "item": "chain5_garden_3_small_plant",
          "asset": "items/chain5_garden_3_small_plant.svg",
          "displayName": "Kleine Pflanze",
          "count": 2
        }
      ],
      "rewards": {
        "coins": 200
      },
      "xp": 34,
      "restorationActions": []
    },
    {
      "id": "order_14",
      "sequence": 14,
      "character": "marina",
      "portrait": "characters/char_marina_friendly.svg",
      "portraitPose": "friendly",
      "dialog": "Die Surfer fragen schon. Hast du etwas Surf-Wachs für sie?",
      "requiredItems": [
        {
          "item": "chain3_surf_2_wax_comb",
          "asset": "items/chain3_surf_2_wax_comb.svg",
          "displayName": "Wachs & Kamm",
          "count": 2
        }
      ],
      "rewards": {
        "coins": 210,
        "energy": 15
      },
      "xp": 36,
      "restorationActions": []
    },
    {
      "id": "order_15",
      "sequence": 15,
      "character": "kai",
      "portrait": "characters/char_kai_friendly.svg",
      "portraitPose": "friendly",
      "dialog": "Setz dich – nachdem du diesen Barhocker herbeigeschafft hast.",
      "requiredItems": [
        {
          "item": "chain4_tool_5_tool_bag",
          "asset": "items/chain4_tool_5_tool_bag.svg",
          "displayName": "Werkzeugtasche",
          "count": 1
        },
        {
          "item": "chain5_garden_3_small_plant",
          "asset": "items/chain5_garden_3_small_plant.svg",
          "displayName": "Kleine Pflanze",
          "count": 1
        }
      ],
      "rewards": {
        "coins": 240,
        "gems": 2
      },
      "xp": 42,
      "restorationActions": [
        "unlock_element:elem_chair_a"
      ]
    },
    {
      "id": "order_16",
      "sequence": 16,
      "character": "gull",